{
  "schema_version": "1.0.0",
  "generated_at": "2026-02-21T23:46:51.870Z",
  "generator": "scripts/classify-claims.mjs",
  "records": [
    {
      "id": "CLAIM-home-001",
      "page_path": "/",
      "source_file": "index.html",
      "selector_hint": "p.platform__panel-body:nth(4)",
      "line": 255,
      "claim_text": "The digital platform connecting founders, SMEs, and operators. Run pilots, solve technical problems, and deploy fast.",
      "claim_type": "opinion",
      "materiality": "low",
      "risk_level": "medium",
      "source_status": "unsourced",
      "source_reference": null,
      "status": "open",
      "owner": "content-ops",
      "last_reviewed": null,
      "review_interval_days": 30,
      "evidence_notes": "auto_classification=opinion; confidence=0.7; rationale=defaulted: no strong objective markers"
    },
    {
      "id": "CLAIM-home-002",
      "page_path": "/",
      "source_file": "index.html",
      "selector_hint": "p.pipeline-stage__desc:nth(5)",
      "line": 317,
      "claim_text": "Real operational problems identified by mission owners",
      "claim_type": "opinion",
      "materiality": "low",
      "risk_level": "medium",
      "source_status": "unsourced",
      "source_reference": null,
      "status": "open",
      "owner": "content-ops",
      "last_reviewed": null,
      "review_interval_days": 30,
      "evidence_notes": "auto_classification=opinion; confidence=0.7; rationale=defaulted: no strong objective markers"
    },
    {
      "id": "CLAIM-home-003",
      "page_path": "/",
      "source_file": "index.html",
      "selector_hint": "p.pipeline-stage__desc:nth(6)",
      "line": 336,
      "claim_text": "Founders and operators matched at The Combine",
      "claim_type": "opinion",
      "materiality": "low",
      "risk_level": "medium",
      "source_status": "unsourced",
      "source_reference": null,
      "status": "open",
      "owner": "content-ops",
      "last_reviewed": null,
      "review_interval_days": 30,
      "evidence_notes": "auto_classification=opinion; confidence=0.7; rationale=defaulted: no strong objective markers"
    },
    {
      "id": "CLAIM-home-004",
      "page_path": "/",
      "source_file": "index.html",
      "selector_hint": "h2.why-merge__title:nth(1)",
      "line": 407,
      "claim_text": "Our national security demands better technology, faster.",
      "claim_type": "opinion",
      "materiality": "high",
      "risk_level": "low",
      "source_status": "unsourced",
      "source_reference": null,
      "status": "open",
      "owner": "content-ops",
      "last_reviewed": null,
      "review_interval_days": 30,
      "evidence_notes": "auto_classification=opinion; confidence=0.95; rationale=contains normative/value language"
    },
    {
      "id": "CLAIM-home-005",
      "page_path": "/",
      "source_file": "index.html",
      "selector_hint": "p:nth(9)",
      "line": 409,
      "claim_text": "Operators face accelerating threats. Founders struggle to access real problems. Traditional acquisition moves slowly, trapped by legacy overhead and siloed processes.",
      "claim_type": "opinion",
      "materiality": "low",
      "risk_level": "medium",
      "source_status": "unsourced",
      "source_reference": null,
      "status": "open",
      "owner": "content-ops",
      "last_reviewed": null,
      "review_interval_days": 30,
      "evidence_notes": "auto_classification=opinion; confidence=0.95; rationale=contains normative/value language"
    },
    {
      "id": "CLAIM-home-006",
      "page_path": "/",
      "source_file": "index.html",
      "selector_hint": "p.why-merge__emphasis:nth(10)",
      "line": 410,
      "claim_text": "Innovation must happen next to the mission — not behind a desk.",
      "claim_type": "opinion",
      "materiality": "low",
      "risk_level": "low",
      "source_status": "unsourced",
      "source_reference": null,
      "status": "open",
      "owner": "content-ops",
      "last_reviewed": null,
      "review_interval_days": 30,
      "evidence_notes": "auto_classification=opinion; confidence=0.95; rationale=contains normative/value language"
    },
    {
      "id": "CLAIM-home-007",
      "page_path": "/",
      "source_file": "index.html",
      "selector_hint": "p:nth(11)",
      "line": 411,
      "claim_text": "Merge creates a new model: A rapid, informed, operator-driven cycle where real problems translate into real prototypes and real deployments.",
      "claim_type": "opinion",
      "materiality": "low",
      "risk_level": "low",
      "source_status": "unsourced",
      "source_reference": null,
      "status": "open",
      "owner": "content-ops",
      "last_reviewed": null,
      "review_interval_days": 30,
      "evidence_notes": "auto_classification=opinion; confidence=0.95; rationale=contains normative/value language"
    },
    {
      "id": "CLAIM-home-008",
      "page_path": "/",
      "source_file": "index.html",
      "selector_hint": "p.bento-card__body:nth(12)",
      "line": 468,
      "claim_text": "One week, in person. Funded and emerging teams get real validation from operators and mission owners close to the requirement.",
      "claim_type": "factual",
      "materiality": "low",
      "risk_level": "medium",
      "source_status": "unsourced",
      "source_reference": null,
      "status": "open",
      "owner": "content-ops",
      "last_reviewed": null,
      "review_interval_days": 30,
      "evidence_notes": "auto_classification=factual; confidence=0.95; rationale=contains concrete/timebound detail"
    },
    {
      "id": "CLAIM-home-009",
      "page_path": "/",
      "source_file": "index.html",
      "selector_hint": "li:nth(11)",
      "line": 473,
      "claim_text": "Pressure-test solution fit with direct operator feedback",
      "claim_type": "opinion",
      "materiality": "low",
      "risk_level": "low",
      "source_status": "unsourced",
      "source_reference": null,
      "status": "open",
      "owner": "content-ops",
      "last_reviewed": null,
      "review_interval_days": 30,
      "evidence_notes": "auto_classification=opinion; confidence=0.7; rationale=defaulted: no strong objective markers"
    },
    {
      "id": "CLAIM-home-010",
      "page_path": "/",
      "source_file": "index.html",
      "selector_hint": "li:nth(12)",
      "line": 474,
      "claim_text": "Leave with decisions, next steps, and champions",
      "claim_type": "opinion",
      "materiality": "low",
      "risk_level": "low",
      "source_status": "unsourced",
      "source_reference": null,
      "status": "open",
      "owner": "content-ops",
      "last_reviewed": null,
      "review_interval_days": 30,
      "evidence_notes": "auto_classification=opinion; confidence=0.7; rationale=defaulted: no strong objective markers"
    },
    {
      "id": "CLAIM-home-011",
      "page_path": "/",
      "source_file": "index.html",
      "selector_hint": "p.bento-card__body:nth(13)",
      "line": 490,
      "claim_text": "We co-found and build ventures born from validated problem sets—backed by operators, technical builders, and deployment partners.",
      "claim_type": "aspirational",
      "materiality": "low",
      "risk_level": "high",
      "source_status": "unsourced",
      "source_reference": null,
      "status": "open",
      "owner": "content-ops",
      "last_reviewed": null,
      "review_interval_days": 30,
      "evidence_notes": "auto_classification=aspirational; confidence=0.7; rationale=contains intent/capability language"
    },
    {
      "id": "CLAIM-home-012",
      "page_path": "/",
      "source_file": "index.html",
      "selector_hint": "p.bento-card__body:nth(14)",
      "line": 512,
      "claim_text": "The platform where builders and mission owners execute: briefs, problems, champions, and access paths to pilots.",
      "claim_type": "opinion",
      "materiality": "low",
      "risk_level": "medium",
      "source_status": "unsourced",
      "source_reference": null,
      "status": "open",
      "owner": "content-ops",
      "last_reviewed": null,
      "review_interval_days": 30,
      "evidence_notes": "auto_classification=opinion; confidence=0.7; rationale=defaulted: no strong objective markers"
    },
    {
      "id": "CLAIM-home-013",
      "page_path": "/",
      "source_file": "index.html",
      "selector_hint": "li:nth(16)",
      "line": 516,
      "claim_text": "Problem sets, champions, and builders in one workflow",
      "claim_type": "opinion",
      "materiality": "low",
      "risk_level": "low",
      "source_status": "unsourced",
      "source_reference": null,
      "status": "open",
      "owner": "content-ops",
      "last_reviewed": null,
      "review_interval_days": 30,
      "evidence_notes": "auto_classification=opinion; confidence=0.7; rationale=defaulted: no strong objective markers"
    },
    {
      "id": "CLAIM-home-014",
      "page_path": "/",
      "source_file": "index.html",
      "selector_hint": "li:nth(17)",
      "line": 517,
      "claim_text": "Briefs (de-attributed) to reduce information overload",
      "claim_type": "opinion",
      "materiality": "low",
      "risk_level": "low",
      "source_status": "unsourced",
      "source_reference": null,
      "status": "open",
      "owner": "content-ops",
      "last_reviewed": null,
      "review_interval_days": 30,
      "evidence_notes": "auto_classification=opinion; confidence=0.7; rationale=defaulted: no strong objective markers"
    },
    {
      "id": "CLAIM-home-015",
      "page_path": "/",
      "source_file": "index.html",
      "selector_hint": "li:nth(18)",
      "line": 518,
      "claim_text": "Guild listings for vetted teams (private beta)",
      "claim_type": "factual",
      "materiality": "low",
      "risk_level": "low",
      "source_status": "unsourced",
      "source_reference": null,
      "status": "open",
      "owner": "content-ops",
      "last_reviewed": null,